{
  "schema": "mantle-source-ingest-plan-v1",
  "plan_blake3": "aaaaaaaaaaaaaaaaaaaaaaaaaaaaaaaaaaaaaaaaaaaaaaaaaaaaaaaaaaaaaaaa",
  "disposition": "add",
  "record_identity": "source/example",
  "candidate_record_bytes_blake3": "bbbbbbbbbbbbbbbbbbbbbbbbbbbbbbbbbbbbbbbbbbbbbbbbbbbbbbbbbbbbbbbb",
  "write_required": true,
  "state_preserved_without_execution": false,
  "reason_code": "new-record",
  "non_claim": "ingest-plan-authorizes-only-the-described-local-state-transition-and-does-not-prove-source-trust-origin-or-release-eligibility"
}
